Objetivo,Indicadores,Códigos Indicadores UNSD †
"7.1 De aquí a 2030, garantizar el acceso universal a servicios energéticos asequibles, fiables y modernos",7.1.1 Proporción de la población que tiene acceso a la electricidad,C070101
"7.1 De aquí a 2030, garantizar el acceso universal a servicios energéticos asequibles, fiables y modernos",7.1.2 Proporción de la población cuya fuente primaria de energía son los combustibles y tecnologías limpios,C070102
"7.2 De aquí a 2030, aumentar considerablemente la proporción de energía renovable en el conjunto de fuentes energéticas",7.2.1 Proporción de energía renovable en el consumo final total de energía,C070201
"7.3 De aquí a 2030, duplicar la tasa mundial de mejora de la eficiencia energética",7.3.1 Intensidad energética medida en función de la energía primaria y el PIB,C070301
"7.a De aquí a 2030, aumentar la cooperación internacional para facilitar el acceso a la investigación y la tecnología relativas a la energía limpia, incluidas las fuentes renovables, la eficiencia energética y las tecnologías avanzadas y menos contaminantes de combustibles fósiles, y promover la inversión en infraestructura energética y tecnologías limpias","7.a.1 Corrientes financieras internacionales hacia los países en desarrollo para apoyar la investigación y el desarrollo de energías limpias y la producción de energía renovable, incluidos los sistemas híbridos",C070a01
"7.b De aquí a 2030, ampliar la infraestructura y mejorar la tecnología para prestar servicios energéticos modernos y sostenibles para todos en los países en desarrollo, en particular los países menos adelantados, los pequeños Estados insulares en desarrollo y los países en desarrollo sin litoral, en consonancia con sus respectivos programas de apoyo",7.b.1 Inversiones en eficiencia energética en proporción al PIB y a la cuantía de la inversión extranjera directa en transferencias financieras destinadas a infraestructura y tecnología para servicios de desarrollo sostenible,C070b01